{
  "schemaVersion": 1,
  "format": "news",
  "id": "NEWS-05",
  "version": 1,
  "title": "SAP Showcases the Autonomous Enterprise in Action",
  "audience": "SAP developers, architects, and business technology teams",
  "language": "en",
  "targetDurationSeconds": 55,
  "news": {
    "event": "SAP Technology Insights 2026",
    "asOf": "2026-10-26",
    "maxAgeDays": 7,
    "editorialStatus": "draft",
    "selection": "editorial",
    "angle": "Examine the technical capability, enterprise context, and real-world availability."
  },
  "sources": [
    {
      "id": "sap-official",
      "title": "SAP Showcases the Autonomous Enterprise in Action",
      "url": "https://news.sap.com/2026/10/sap-connect-keynote-autonomous-enterprise-in-action/",
      "retrievedOn": "2026-10-26",
      "publisher": "SAP",
      "publishedOn": "2026-10-26"
    }
  ],
  "claims": [
    {
      "id": "announcement-core",
      "text": "From now on, the more than 400 million.",
      "sourceIds": [
        "sap-official"
      ],
      "checkedOn": "2026-10-26",
      "availability": {
        "status": "announced",
        "timing": "Published 2026-10-26",
        "scope": "Official SAP news announcement."
      },
      "support": [
        {
          "sourceId": "sap-official",
          "locator": "Opening announcement and core capabilities",
          "summary": "Cites official SAP release details."
        }
      ]
    },
    {
      "id": "technical-impact",
      "text": "Because the agents operate within deterministic application workflows.",
      "sourceIds": [
        "sap-official"
      ],
      "checkedOn": "2026-10-26",
      "availability": {
        "status": "announced",
        "timing": "Available in current architecture release",
        "scope": "Enterprise platform and data structures."
      },
      "support": [
        {
          "sourceId": "sap-official",
          "locator": "Technical impact and architectural considerations",
          "summary": "Explains enterprise process and integration benefits."
        }
      ]
    },
    {
      "id": "rollout-availability",
      "text": "Since SAP Sapphire, Klein said SAP has created.",
      "sourceIds": [
        "sap-official"
      ],
      "checkedOn": "2026-10-26",
      "availability": {
        "status": "announced",
        "timing": "Ongoing platform rollout",
        "scope": "Global SAP customer and cloud deployments."
      },
      "support": [
        {
          "sourceId": "sap-official",
          "locator": "Availability and roadmap details",
          "summary": "Details the rollout schedule and prerequisites."
        }
      ]
    }
  ],
  "scenes": [
    {
      "id": "hook",
      "phase": "hook",
      "startSeconds": 0,
      "endSeconds": 3,
      "narration": "Autonomous enterprise is finally here.",
      "overlay": "Autonomous enterprise arrives",
      "claimIds": [],
      "visual": {
        "kind": "presenter",
        "label": "Opening hook"
      }
    },
    {
      "id": "context",
      "phase": "context",
      "startSeconds": 3,
      "endSeconds": 10,
      "narration": "Checked today from official SAP news. Just five months after promising customers that it would enable them to become AI-native.",
      "overlay": "What changed today",
      "claimIds": [],
      "visual": {
        "kind": "presenter",
        "label": "As of 2026-10-26"
      }
    },
    {
      "id": "headline-1",
      "phase": "headline",
      "startSeconds": 10,
      "endSeconds": 21,
      "narration": "First, From now on, the more than 400 million SAP users can talk in their own language to SAP, and Joule Work gets the job done.”&nbsp;",
      "overlay": "1. Core announcement",
      "claimIds": [
        "announcement-core"
      ],
      "visual": {
        "kind": "news-card",
        "label": "Official announcement"
      }
    },
    {
      "id": "headline-2",
      "phase": "headline",
      "startSeconds": 21,
      "endSeconds": 31,
      "narration": "Second, Because the agents operate within deterministic application workflows, they use the same data, follow the same rules, and leave the same audit trail as the applications themselves.",
      "overlay": "2. Why it matters",
      "claimIds": [
        "technical-impact"
      ],
      "visual": {
        "kind": "news-card",
        "label": "Architecture & impact"
      }
    },
    {
      "id": "headline-3",
      "phase": "headline",
      "startSeconds": 31,
      "endSeconds": 43,
      "narration": "Third, Since SAP Sapphire, Klein said SAP has created more than 20 Joule Assistants and over 200 Joule Agents, and is aiming for more than 400 agents by year-end.",
      "overlay": "3. When it ships",
      "claimIds": [
        "rollout-availability"
      ],
      "visual": {
        "kind": "news-card",
        "label": "Rollout & availability"
      }
    },
    {
      "id": "payoff",
      "phase": "payoff",
      "startSeconds": 43,
      "endSeconds": 49,
      "narration": "My takeaway: Examine the technical capability, enterprise context, and real-world availability.",
      "overlay": "Editorial takeaway",
      "claimIds": [],
      "visual": {
        "kind": "presenter",
        "label": "Editorial takeaway"
      }
    },
    {
      "id": "cta",
      "phase": "cta",
      "startSeconds": 49,
      "endSeconds": 55,
      "narration": "Read the official announcement in the link below. How will this impact your architecture?",
      "overlay": "Read source. Share thoughts.",
      "claimIds": [],
      "visual": {
        "kind": "presenter",
        "label": "Discussion & CTA"
      }
    }
  ],
  "pronunciation": {
    "AI": "ay eye",
    "SAP": "sap",
    "Joule": "jool"
  },
  "publication": {
    "channel": "linkedin",
    "text": "SAP Showcases the Autonomous Enterprise in Action\n\nJust five months after promising customers that it would enable them to become AI-native autonomous enterprises , SAP has delivered: showcasing it with on-stage demos and live customers at SAP Connect in Las Vegas.\n\nKey takeaways from the official announcement:\n1. Core capability: From now on, the more than 400 million SAP users can talk in their own language to SAP, and Joule Wo\n2. Architecture impact: Because the agents operate within deterministic application workflows, they use the same data, follo\n3. Availability: Since SAP Sapphire, Klein said SAP has created more than 20 Joule Assistants and over 200 Joule Agen\n\nRead the official source: https://news.sap.com/2026/10/sap-connect-keynote-autonomous-enterprise-in-action/\n\nHow is your organization preparing for this in your enterprise architecture?\n\n#SAP #BusinessAI #EnterpriseArchitecture #CloudERP #SAPBTP"
  }
}
